{
  "schema_version": 1,
  "receipt_id": "44444444-4444-4444-8444-444444444444",
  "proposal_id": "11111111-1111-4111-8111-111111111111",
  "phase": "execute",
  "proposal_revision": 1,
  "payload_hash": "025b6f8ab0826324bbcbc4d2d3d7e92a492735931c4543639bb96e043726475c",
  "attempt": 1,
  "outcome": "succeeded",
  "device_id_hash": "bbbbbbbbbbbbbbbbbbbbbbbbbbbbbbbbbbbbbbbbbbbbbbbbbbbbbbbbbbbbbbbb",
  "execution_mode": "online_lease",
  "lease_id": "55555555-5555-4555-8555-555555555555",
  "result": { "summary": "Calendar event created", "resource_kind": "calendar_event", "scheduled_at": "2026-08-27T01:00:00.000Z", "ended_at": null },
  "error_code": null,
  "reconciliation_state": "confirmed",
  "undo_capability": "reversible",
  "external_id_hash": "cccccccccccccccccccccccccccccccccccccccccccccccccccccccccccccccc",
  "started_at": "2026-08-26T10:06:00.000Z",
  "completed_at": "2026-08-26T10:06:01.000Z"
}
